{"$schema":"https://json-schema.org/draft/2020-12/schema","title":"Sector heatmap manual input","type":"object","required":["as_of_date","run_type","regime","weights","sectors"],"properties":{"as_of_date":{"type":"string","format":"date"},"run_type":{"enum":["premarket","after_close","manual"]},"regime":{"type":"object","required":["label","confidence","evidence","disconfirming_evidence"],"properties":{"label":{"type":"string"},"confidence":{"enum":["low","medium","high"]},"evidence":{"type":"array","items":{"type":"string"}},"disconfirming_evidence":{"type":"array","items":{"type":"string"}}}},"weights":{"type":"object"},"sectors":{"type":"object"}}}