{"as_of_date":"YYYY-MM-DD","run_type":"manual","regime":{"label":"unknown","confidence":"low","evidence":[],"disconfirming_evidence":[]},"weights":{"day":{"regime_fit":0.15,"breadth":0.25,"relative_momentum":0.25,"volume_confirmation":0.2,"macro_catalyst":0.1,"risk_penalty_max":0.05},"week":{"regime_fit":0.3,"breadth":0.2,"relative_momentum":0.2,"volume_confirmation":0.15,"macro_catalyst":0.1,"risk_penalty_max":0.05},"month":{"regime_fit":0.4,"breadth":0.15,"relative_momentum":0.15,"volume_confirmation":0.1,"macro_catalyst":0.15,"risk_penalty_max":0.05}},"sectors":{}}